{
  "$schema": "./legacy-url-actions.schema.json",
  "domain": "perlcoders.com",
  "generated_from": "DataForSEO backlink sample and dated web-archive review on 2026-08-22",
  "review_status": "owner-authorized-live; independent-perl-review-outstanding",
  "records": [
    {
      "source_url": "http://www.perlcoders.com/main/scripts.html?script=SimpleRing",
      "normalized_path": "/main/scripts.html?script=simplering",
      "first_seen": "2001-01-01",
      "last_seen": "2026-08-22",
      "former_topic": "Webring administration",
      "former_title": "SimpleRing",
      "archive_evidence": "Dated 2003 capture describes administration, user controls and automatic or manual member acceptance.",
      "referring_domains": 14,
      "backlink_quality": "mixed; several mirrored webring directories, one historically relevant cohort",
      "anchors": ["SimpleRing", "PerlCoders"],
      "clean_spam_class": "clean-with-mirror-inflation",
      "rights_status": "reference-only; no historical copy or assets reproduced",
      "current_demand": "historical navigation and link resolution",
      "action": "redirect_301",
      "target_url": "/archive/simplering/",
      "equivalence_reason": "The destination is an independently written reference for the same named script and intent.",
      "evidence_sources": ["https://web.archive.org/web/20030609163652/http://www.perlcoders.com/main/scripts.html?script=SimpleRing"],
      "reviewer": null,
      "approved_at": null,
      "last_tested_at": "2026-08-22T18:30:55.597Z"
    },
    {
      "source_url": "http://www.perlcoders.com/main/scripts.html?script=TotalNews",
      "normalized_path": "/main/scripts.html?script=totalnews",
      "first_seen": "2003-01-01",
      "last_seen": "2026-08-22",
      "former_topic": "Multipart newsletter management",
      "former_title": "TotalNews",
      "archive_evidence": "Dated 2003 capture describes HTML and plain-text newsletters, headers, footers and multiple categories.",
      "referring_domains": 3,
      "backlink_quality": "historically relevant but partly duplicated directory links",
      "anchors": ["TotalNews"],
      "clean_spam_class": "clean-with-directory-duplication",
      "rights_status": "reference-only",
      "current_demand": "historical navigation",
      "action": "redirect_301",
      "target_url": "/archive/totalnews/",
      "equivalence_reason": "Same named software and purpose, described independently with safety context.",
      "evidence_sources": ["https://web.archive.org/web/20030609154539/http://www.perlcoders.com/main/scripts.html?script=TotalNews"],
      "reviewer": null,
      "approved_at": null,
      "last_tested_at": "2026-08-22T18:30:55.597Z"
    },
    {
      "source_url": "http://www.perlcoders.com/main/scripts2.html?script=SimleGallery",
      "normalized_path": "/main/scripts2.html?script=simlegallery",
      "first_seen": "2006-01-01",
      "last_seen": "2026-08-22",
      "former_topic": "Scheduled image gallery rotation",
      "former_title": "SimleGallery",
      "archive_evidence": "Dated 2006 capture describes a daily gallery rotator that creates thumbnails and is run by cron.",
      "referring_domains": 1,
      "backlink_quality": "topically relevant live software-resource forum link",
      "anchors": ["SimleGallery"],
      "clean_spam_class": "clean",
      "rights_status": "reference-only",
      "current_demand": "historical navigation",
      "action": "redirect_301",
      "target_url": "/archive/simlegallery/",
      "equivalence_reason": "Same historically misspelled product name and independently written purpose summary.",
      "evidence_sources": ["https://web.archive.org/web/20060207155013/http://www.perlcoders.com/main/scripts2.html?script=SimleGallery", "https://www.php-resource.de/forum/php-developer-forum/68652-simlegallery-perl-cgi-script"],
      "reviewer": null,
      "approved_at": null,
      "last_tested_at": "2026-08-22T18:30:55.597Z"
    },
    {
      "source_url": "http://www.perlcoders.com/main/scripts.html?script=WeddingRegistry",
      "normalized_path": "/main/scripts.html?script=weddingregistry",
      "first_seen": "2003-01-01",
      "last_seen": "2026-08-22",
      "former_topic": "Online gift registry",
      "former_title": "WeddingRegistry",
      "archive_evidence": "Dated 2003 capture describes a MySQL-backed gift registry that prevents duplicate claims and emails guests.",
      "referring_domains": 1,
      "backlink_quality": "topically relevant historical forum link",
      "anchors": ["WeddingRegistry"],
      "clean_spam_class": "clean",
      "rights_status": "reference-only",
      "current_demand": "historical navigation",
      "action": "redirect_301",
      "target_url": "/archive/wedding-registry/",
      "equivalence_reason": "Same named software and original task, without restoring commerce or data-processing behavior.",
      "evidence_sources": ["https://web.archive.org/web/20030609155931/http://www.perlcoders.com/main/scripts.html?script=WeddingRegistry"],
      "reviewer": null,
      "approved_at": null,
      "last_tested_at": "2026-08-22T18:30:55.597Z"
    },
    {
      "source_url": "http://www.perlcoders.com/main/scripts.html?script=URLSpider",
      "normalized_path": "/main/scripts.html?script=urlspider",
      "first_seen": "2003-01-01",
      "last_seen": "2026-08-22",
      "former_topic": "Recursive URL crawling",
      "former_title": "URLSpider",
      "archive_evidence": "Dated 2003 capture describes recursively following page links and producing a URL list from a shell session.",
      "referring_domains": 1,
      "backlink_quality": "stale directory reference",
      "anchors": ["URLSpider"],
      "clean_spam_class": "low-value-clean",
      "rights_status": "reference-only",
      "current_demand": "historical navigation",
      "action": "redirect_301",
      "target_url": "/archive/urlspider/",
      "equivalence_reason": "Same named crawler and purpose, with modern safety boundaries.",
      "evidence_sources": ["https://web.archive.org/web/20030609160623/http://www.perlcoders.com/main/scripts.html?script=URLSpider"],
      "reviewer": null,
      "approved_at": null,
      "last_tested_at": "2026-08-22T18:30:55.597Z"
    },
    {
      "source_url": "http://www.perlcoders.com/scripts/info/linkchecker/info.html",
      "normalized_path": "/scripts/info/linkchecker/info.html",
      "first_seen": "2001-01-01",
      "last_seen": "2026-08-22",
      "former_topic": "Resumable link status checking",
      "former_title": "LinkChecker",
      "archive_evidence": "Dated 2001 capture describes classifying redirects, successes, forbidden responses and missing pages while resuming via DBM.",
      "referring_domains": 1,
      "backlink_quality": "exact-topic legacy resource link from a high-spam host",
      "anchors": ["LinkChecker"],
      "clean_spam_class": "mixed-source",
      "rights_status": "reference-only",
      "current_demand": "historical navigation",
      "action": "redirect_301",
      "target_url": "/archive/linkchecker/",
      "equivalence_reason": "Same named utility and task; the destination does not endorse or distribute the old executable.",
      "evidence_sources": ["https://web.archive.org/web/20011214071352/http://www.perlcoders.com/scripts/info/linkchecker/info.html"],
      "reviewer": null,
      "approved_at": null,
      "last_tested_at": "2026-08-22T18:30:55.597Z"
    },
    {
      "source_url": "http://www.perlcoders.com/main/crontab.html",
      "normalized_path": "/main/crontab.html",
      "first_seen": "2001-01-01",
      "last_seen": "2026-08-22",
      "former_topic": "Scheduling recurring jobs",
      "former_title": "Crontab tutorial",
      "archive_evidence": "Dated 2001 capture presents basic periodic scheduling and a CGI-oriented example.",
      "referring_domains": 1,
      "backlink_quality": "live, topically relevant external citation",
      "anchors": ["crontab", "cron jobs"],
      "clean_spam_class": "clean",
      "rights_status": "independently-written replacement; archive linked as provenance only",
      "current_demand": "evergreen operational guidance",
      "action": "restore_200",
      "target_url": "/now/cron-jobs/",
      "equivalence_reason": "The new guide answers the same scheduling intent with current operational safeguards and original wording.",
      "evidence_sources": ["https://web.archive.org/web/20011205090442/http://www.perlcoders.com/main/crontab.html", "https://pubs.opengroup.org/onlinepubs/9699919799/utilities/crontab.html", "https://kubernetes.io/docs/concepts/workloads/controllers/cron-jobs/"],
      "reviewer": null,
      "approved_at": null,
      "last_tested_at": "2026-08-22T18:30:55.597Z"
    },
    {
      "source_url": "http://www.perlcoders.com/main/scripts.html?cat=19",
      "normalized_path": "/main/scripts.html?cat=19",
      "first_seen": null,
      "last_seen": "2026-08-22",
      "former_topic": "Software catalogue category",
      "former_title": null,
      "archive_evidence": "A live forum link targets the category, but no single product intent can be established.",
      "referring_domains": 1,
      "backlink_quality": "live historical category link",
      "anchors": ["PerlCoders scripts"],
      "clean_spam_class": "clean",
      "rights_status": "reference-only",
      "current_demand": "archive browsing",
      "action": "redirect_301",
      "target_url": "/archive/",
      "equivalence_reason": "The archive hub is the nearest equivalent catalogue overview; no product page is implied.",
      "evidence_sources": ["https://www.forosdelweb.com/"],
      "reviewer": null,
      "approved_at": null,
      "last_tested_at": "2026-08-22T18:30:55.597Z"
    },
    {
      "source_url": "http://www.perlcoders.com/scripts/info/simplearea/info.html",
      "normalized_path": "/scripts/info/simplearea/info.html",
      "first_seen": "2001-01-01",
      "last_seen": "2026-08-22",